<?xml version="1.0" encoding="UTF-8"?>
<!DOCTYPE NAMM_ITEM SYSTEM "attr_focused_complex.dtd">
<NAMM_ITEM version="2007.1">
    <SupplierId>0761294001004</SupplierId>
    <Items>
        <Item>
            <Supplier ItemId="FantomX6" Model="Fantom-X6" />
            <ItemDesc>Workstation Keyboard</ItemDesc>
            <ItemDescLong>Powerhouse Workstation with an Ultra-Friendly Interface</ItemDescLong>
            <RetailValue>2395</RetailValue>
            <UCValue>1437</UCValue>
            <CountryOrigin>China</CountryOrigin>
            <BrandName>Roland</BrandName>
            <Length>1050</Length>
            <Width>358</Width>
            <Height>125</Height>
            <DimUOM>mm</DimUOM>
            <Weight>12.5</Weight>
            <WeightUOM>kg</WeightUOM>
            <BarCode Desc="UPC" Id="761294084991" />
            <C DimUOM="In" Height="6" Length="43" QtyPerUOM="1" UOM="EA" Weight="13" WeightUOM="kg" Width="15" />
            <Kit>false</Kit>
            <Serialized>true</Serialized>
            <AnnounceDate>2006-01-15</AnnounceDate>
            <AvailableDate>2006-02-24</AvailableDate>
            <Warranty LabTerm="365" LabUOM="Day" PartTerm="90" PartUOM="Day" />
            <Category>Keyboard</Category>
            <Images>FantomX6.jpg</Images>
            <ImageURL>http://www.rolandus.com/press/images</ImageURL>
            <ProductURL>http://www.rolandus.com/products/productdetails.aspx?ObjectId=581</ProductURL>
        </Item>
    </Items>
</NAMM_ITEM>